<?xml version="1.0" encoding="UTF-8"?>
<mapping tagNameBase="org.dentaku.gentaku.jdo" xmlns:xs="http://www.w3.org/2001/XMLSchema-instance" xs:noNamespaceSchemaLocation="gengenMapping.xsd">
	<element path="/xs:schema/xs:element[@name='jdo']" location="root"/>
	<element path="/xs:schema/xs:element[@name='package']" location="package">
		<stereotype name="Package"/>
	</element>
	<element path="/xs:schema/xs:element[@name='class']" location="class">
		<stereotype name="Entity">
			<generator canonicalName="org.dentaku.gentaku.cartridge.jdo.EntityGenerator"/>
		</stereotype>
	</element>
	<element path="/xs:schema/xs:element[@name='field']" location="field"/>
</mapping>
